<?xml version="1.0" encoding="UTF-8"?>
<PatentHistory xmlns="http://ns.hr-xml.org/2007-04-15" xmlns:xsi="http://www.w3.org/2001/XMLSchema-instance" xsi:schemaLocation="http://ns.hr-xml.org/2007-04-15
PatentHistory.xsd">
	<Patent>
		<PatentTitle>Optical Fiber Image Conduit and Method Using Same</PatentTitle>
		<Description>The Ultrascope is a camera accessory that attaches to existing photographic and video cameras to access small viewing areas that are normally restricted to more expensive equipment. The present invention employs a steering system to view hard-to-reach regions. The materials that are used for the invention make the product an attractive and affordable accessory. The design makes the product simple to use, available to the professional and novice user. Additionally, it improves visibility in small, dark areas and is made from durable materials.</Description>
		<Inventors>
			<InventorName>Jorge O. Sanchez</InventorName>
		</Inventors>
		<PatentDetail>
			<IssuingAuthority countryCode="US">US Patent and Trademark Office</IssuingAuthority>
			<PatentMilestone>
				<Status>PatentFiled</Status>
				<Date>1996-06-01</Date>
			</PatentMilestone>
			<PatentMilestone>
				<Id>08-76853</Id>
				<Status>PatentPending</Status>
				<Date>1997-09-01</Date>
			</PatentMilestone>
			<PatentMilestone>
				<Id>5,960,145</Id>
				<Status>PatentIssued</Status>
				<Date>1999-09-01</Date>
			</PatentMilestone>
		</PatentDetail>
		<Link>http://patents.patentbase.com/ultrascope</Link>
	</Patent>
</PatentHistory>
